{
  "generated_at": "2026-10-01T11:43:44Z",
  "source": "mixed",
  "status": "ok",
  "cross_checked": true,
  "today": {
    "date": "2026-10-01",
    "events": [
      {
        "time_et": "08:30",
        "time_cet": "14:30",
        "title": "Unemployment Claims",
        "title_cs": "Žádosti o podporu v nezaměstnanosti",
        "impact": "medium",
        "forecast": "201K",
        "previous": "197K"
      },
      {
        "time_et": "10:00",
        "time_cet": "16:00",
        "title": "FOMC Member Waller Speaks",
        "title_cs": "Projev člena FOMC Wallera",
        "impact": "medium",
        "forecast": null,
        "previous": null
      },
      {
        "time_et": "10:00",
        "time_cet": "16:00",
        "title": "ISM Manufacturing PMI",
        "title_cs": "Index nákupních manažerů ISM ve zpracovatelském průmyslu",
        "impact": "medium",
        "forecast": "54.8",
        "previous": "54.6"
      }
    ]
  },
  "tomorrow": {
    "date": "2026-10-02",
    "events": [
      {
        "time_et": "08:30",
        "time_cet": "14:30",
        "title": "Average Hourly Earnings m/m",
        "title_cs": "Průměrná hodinová mzda, měsíční změna",
        "impact": "high",
        "forecast": "0.3%",
        "previous": "0.3%"
      },
      {
        "time_et": "08:30",
        "time_cet": "14:30",
        "title": "Non-Farm Employment Change",
        "title_cs": "Změna počtu pracovních míst mimo zemědělství (NFP)",
        "impact": "high",
        "forecast": "89K",
        "previous": "162K"
      },
      {
        "time_et": "08:30",
        "time_cet": "14:30",
        "title": "Unemployment Rate",
        "title_cs": "Míra nezaměstnanosti",
        "impact": "high",
        "forecast": "4.1%",
        "previous": "4.1%"
      }
    ]
  },
  "flags": {
    "big_macro_today": false,
    "big_macro_tomorrow": true,
    "megacap_earnings_today_after_close": null,
    "shortened_session_or_holiday": false
  },
  "notes": "Zdroj událostí: forexfactory.com (HTML, embedded JSON, dateline Unix); filtr USD, dopad high/medium; data dle východoamerického času (ET). Křížová kontrola: federalreserve.gov (json/calendar.json, fomccalendars), bls.gov, nyse.com. Převod času: ET (EDT, UTC−4) → SELČ (UTC+2), posun +6 h. Klíč time_cet obsahuje pražský místní čas (SELČ/CEST). big_macro = rozhodnutí Fedu o sazbách, projev předsedy Fedu, CPI, PPI, NFP. Fed (2026-10-01): projevy: Governor Lisa D. Cook 3:30 p.m.; Vice Chair for Supervision Michelle W. Bowman 3:00 p.m.; Vice Chair Philip N. Jefferson 1:30 p.m.; Governor Christopher J. Waller 10:00 a.m.; předseda Fedu (Chair) nevystupuje; žádné rozhodnutí FOMC. Fed (2026-10-02): žádné projevy; předseda Fedu (Chair) nevystupuje; žádné rozhodnutí FOMC. Zasedání FOMC 2026 (rozhodnutí): 2026-01-28, 2026-03-18, 2026-04-29, 2026-06-17, 2026-07-29, 2026-09-16, 2026-10-28, 2026-12-09. BLS rozvrh 2026-10: přímý dotaz na bls.gov selhal (bls.gov HTTP 403), použit text rozvrhu z bls.gov dodaný plánovacím agentem (--bls-text). BLS rozvrh: Employment Situation 2026-10-02; CPI 2026-10-14; PPI 2026-10-15 (8:30 ET). NYSE: 2026-10-01 ani 2026-10-02 nejsou v seznamu svátků ani zkrácených seancí NYSE → běžné obchodní dny (příznak shortened_session_or_holiday se týká dneška nebo zítřka). Megacap výsledky (NVDA AAPL MSFT AMZN GOOGL META TSLA) dnes po uzavření trhu: null – nemám potvrzené oznámení od společností; data z Nasdaq kalendáře jsou jen odhady. Nejde o investiční doporučení."
}
